2025-12-29 20:18:01,582 - INFO - Merging configs:
2025-12-29 20:18:01,582 - INFO -   Base: configs/base.yaml
2025-12-29 20:18:01,582 - INFO -   Domain: configs/domains/clapnq.yaml
2025-12-29 20:18:01,582 - INFO -   Experiment: configs/experiments/0-baselines/replication_bm25.yaml
2025-12-29 20:18:01,600 - INFO - ✓ Config merged successfully
2025-12-29 20:18:25,429 - INFO - Merging configs:
2025-12-29 20:18:25,429 - INFO -   Base: configs/base.yaml
2025-12-29 20:18:25,429 - INFO -   Domain: configs/domains/clapnq.yaml
2025-12-29 20:18:25,429 - INFO -   Experiment: configs/experiments/0-baselines/replication_bm25.yaml
2025-12-29 20:18:25,440 - INFO - ✓ Config merged successfully
2025-12-29 20:22:38,012 - INFO - Merging configs:
2025-12-29 20:22:38,013 - INFO -   Base: configs/base.yaml
2025-12-29 20:22:38,013 - INFO -   Domain: configs/domains/clapnq.yaml
2025-12-29 20:22:38,013 - INFO -   Experiment: configs/experiments/0-baselines/replication_bm25.yaml
2025-12-29 20:22:38,025 - INFO - ✓ Config merged successfully
2025-12-31 01:47:51,695 - INFO -   Building BM25 index...
2025-12-31 01:47:51,696 - INFO - Initializing BM25 Indexer for clapnq
2025-12-31 01:47:51,697 - INFO - Tokenizing corpus...
2025-12-31 01:47:51,697 - ERROR -   ✗ Failed to build index: name 'word_tokenize' is not defined
2025-12-31 01:47:51,779 - INFO - 
================================================================================
2025-12-31 01:47:51,779 - INFO - SUMMARY
2025-12-31 01:47:51,780 - INFO - ================================================================================
2025-12-31 01:47:51,780 - INFO - Total indices: 1
2025-12-31 01:47:51,780 - INFO - Successful: 0
2025-12-31 01:47:51,780 - INFO - Failed: 1
2025-12-31 01:47:51,780 - ERROR - 
Failed indices:
2025-12-31 01:47:51,780 - ERROR -   - clapnq/bm25
2025-12-31 01:49:59,141 - INFO -   Building BM25 index...
2025-12-31 01:49:59,144 - INFO - Initializing BM25 Indexer for clapnq
2025-12-31 01:49:59,144 - INFO - Tokenizing corpus...
2025-12-31 01:49:59,146 - ERROR -   ✗ Failed to build index: 
**********************************************************************
  Resource [93mpunkt_tab[0m not found.
  Please use the NLTK Downloader to obtain the resource:

  [31m>>> import nltk
  >>> nltk.download('punkt_tab')
  [0m
  For more information see: https://www.nltk.org/data.html

  Attempted to load [93mtokenizers/punkt_tab/english/[0m

  Searched in:
    - '/Users/vania/nltk_data'
    - '/Users/vania/Downloads/rag-ss3/mt-rag-benchmark/task_a_retrieval/.venv/nltk_data'
    - '/Users/vania/Downloads/rag-ss3/mt-rag-benchmark/task_a_retrieval/.venv/share/nltk_data'
    - '/Users/vania/Downloads/rag-ss3/mt-rag-benchmark/task_a_retrieval/.venv/lib/nltk_data'
    - '/usr/share/nltk_data'
    - '/usr/local/share/nltk_data'
    - '/usr/lib/nltk_data'
    - '/usr/local/lib/nltk_data'
**********************************************************************

2025-12-31 01:49:59,149 - INFO - 
================================================================================
2025-12-31 01:49:59,150 - INFO - SUMMARY
2025-12-31 01:49:59,150 - INFO - ================================================================================
2025-12-31 01:49:59,150 - INFO - Total indices: 1
2025-12-31 01:49:59,150 - INFO - Successful: 0
2025-12-31 01:49:59,150 - INFO - Failed: 1
2025-12-31 01:49:59,150 - ERROR - 
Failed indices:
2025-12-31 01:49:59,150 - ERROR -   - clapnq/bm25
2025-12-31 01:50:40,221 - INFO -   Building BM25 index...
2025-12-31 01:50:40,221 - INFO - Initializing BM25 Indexer for clapnq
2025-12-31 01:50:40,221 - INFO - Tokenizing corpus...
2025-12-31 01:50:40,222 - ERROR -   ✗ Failed to build index: 
**********************************************************************
  Resource [93mpunkt_tab[0m not found.
  Please use the NLTK Downloader to obtain the resource:

  [31m>>> import nltk
  >>> nltk.download('punkt_tab')
  [0m
  For more information see: https://www.nltk.org/data.html

  Attempted to load [93mtokenizers/punkt_tab/english/[0m

  Searched in:
    - '/Users/vania/nltk_data'
    - '/Users/vania/Downloads/rag-ss3/mt-rag-benchmark/task_a_retrieval/.venv/nltk_data'
    - '/Users/vania/Downloads/rag-ss3/mt-rag-benchmark/task_a_retrieval/.venv/share/nltk_data'
    - '/Users/vania/Downloads/rag-ss3/mt-rag-benchmark/task_a_retrieval/.venv/lib/nltk_data'
    - '/usr/share/nltk_data'
    - '/usr/local/share/nltk_data'
    - '/usr/lib/nltk_data'
    - '/usr/local/lib/nltk_data'
**********************************************************************

2025-12-31 01:50:40,227 - INFO - 
================================================================================
2025-12-31 01:50:40,227 - INFO - SUMMARY
2025-12-31 01:50:40,227 - INFO - ================================================================================
2025-12-31 01:50:40,227 - INFO - Total indices: 1
2025-12-31 01:50:40,227 - INFO - Successful: 0
2025-12-31 01:50:40,227 - INFO - Failed: 1
2025-12-31 01:50:40,227 - ERROR - 
Failed indices:
2025-12-31 01:50:40,227 - ERROR -   - clapnq/bm25
2025-12-31 01:52:18,630 - INFO -   Building BM25 index...
2025-12-31 01:52:18,631 - INFO - Initializing BM25 Indexer for clapnq
2025-12-31 01:52:18,632 - INFO - Tokenizing corpus...
2025-12-31 01:54:44,088 - INFO - Building BM25 index...
2025-12-31 01:54:50,898 - INFO - Saving BM25 index to indices/clapnq/bm25/index.pkl...
2025-12-31 01:54:56,597 - INFO - BM25 Indexing complete.
2025-12-31 01:54:58,129 - INFO -   ✓ Index built successfully
2025-12-31 01:54:58,130 - INFO - 
================================================================================
2025-12-31 01:54:58,130 - INFO - SUMMARY
2025-12-31 01:54:58,131 - INFO - ================================================================================
2025-12-31 01:54:58,131 - INFO - Total indices: 1
2025-12-31 01:54:58,131 - INFO - Successful: 1
2025-12-31 01:54:58,132 - INFO - Failed: 0
2025-12-31 01:54:58,132 - INFO - 
✓ All indices built successfully!
2026-01-05 19:15:11,584 - INFO -   Building BM25 index...
2026-01-05 19:15:11,584 - INFO - Initializing BM25 Indexer for cloud
2026-01-05 19:15:11,584 - INFO - Tokenizing corpus...
2026-01-05 19:15:18,735 - INFO -   Building BM25 index...
2026-01-05 19:15:18,735 - INFO - Initializing BM25 Indexer for cloud
2026-01-05 19:15:18,735 - INFO - Tokenizing corpus...
2026-01-05 19:15:32,476 - INFO -   Building BM25 index...
2026-01-05 19:15:32,476 - INFO - Initializing BM25 Indexer for fiqa
2026-01-05 19:15:32,476 - INFO - Tokenizing corpus...
2026-01-05 19:16:01,429 - INFO -   Building BM25 index...
2026-01-05 19:16:01,429 - INFO - Initializing BM25 Indexer for fiqa
2026-01-05 19:16:01,429 - INFO - Tokenizing corpus...
2026-01-05 19:16:39,510 - INFO - Building BM25 index...
2026-01-05 19:16:41,514 - INFO - Saving BM25 index to indices/fiqa/bm25/index.pkl...
2026-01-05 19:16:43,097 - INFO - BM25 Indexing complete.
2026-01-05 19:16:43,327 - INFO -   ✓ Index built successfully
2026-01-05 19:16:43,327 - INFO - 
================================================================================
2026-01-05 19:16:43,327 - INFO - Index 3/4: govt/bm25
2026-01-05 19:16:43,327 - INFO - ================================================================================

2026-01-05 19:16:43,327 - WARNING - Index directory exists but seems incomplete (missing _SUCCESS). Rebuilding: indices/govt/bm25
2026-01-05 19:16:43,327 - INFO - Building bm25 index for govt
2026-01-05 19:16:43,328 - INFO -   Corpus: data/passage_level_processed/govt/corpus.jsonl
2026-01-05 19:16:43,328 - INFO -   Output: indices/govt/bm25
2026-01-05 19:16:43,832 - INFO -   Building BM25 index...
2026-01-05 19:16:43,832 - INFO - Initializing BM25 Indexer for govt
2026-01-05 19:16:43,832 - INFO - Tokenizing corpus...
2026-01-05 19:17:33,952 - INFO - Building BM25 index...
2026-01-05 19:17:36,818 - INFO - Saving BM25 index to indices/govt/bm25/index.pkl...
2026-01-05 19:17:39,160 - INFO - BM25 Indexing complete.
2026-01-05 19:17:39,505 - INFO -   ✓ Index built successfully
2026-01-05 19:17:39,529 - INFO - 
================================================================================
2026-01-05 19:17:39,529 - INFO - Index 4/4: cloud/bm25
2026-01-05 19:17:39,529 - INFO - ================================================================================

2026-01-05 19:17:39,529 - WARNING - Index directory exists but seems incomplete (missing _SUCCESS). Rebuilding: indices/cloud/bm25
2026-01-05 19:17:39,529 - INFO - Building bm25 index for cloud
2026-01-05 19:17:39,529 - INFO -   Corpus: data/passage_level_processed/cloud/corpus.jsonl
2026-01-05 19:17:39,529 - INFO -   Output: indices/cloud/bm25
2026-01-05 19:17:40,096 - INFO -   Building BM25 index...
2026-01-05 19:17:40,096 - INFO - Initializing BM25 Indexer for cloud
2026-01-05 19:17:40,096 - INFO - Tokenizing corpus...
2026-01-05 19:18:24,503 - INFO -   Building BGE-M3 index...
2026-01-05 19:18:24,503 - INFO - Initializing BGE Indexer with BAAI/bge-m3 on cuda
2026-01-05 19:18:24,505 - INFO - Load pretrained SentenceTransformer: BAAI/bge-m3
2026-01-05 19:18:38,732 - INFO - Encoding 183408 documents...
2026-01-05 19:18:38,733 - INFO - 🚀 Using 2 GPUs for parallel encoding!
2026-01-05 19:18:38,733 - INFO - Start multi-process pool on devices: cuda:0, cuda:1
2026-01-05 19:19:00,087 - INFO - Building BM25 index...
2026-01-05 19:19:03,884 - INFO - Saving BM25 index to indices/cloud/bm25/index.pkl...
2026-01-05 19:19:06,455 - INFO - BM25 Indexing complete.
2026-01-05 19:19:06,945 - INFO -   ✓ Index built successfully
2026-01-05 19:19:06,987 - INFO - 
================================================================================
2026-01-05 19:19:06,987 - INFO - SUMMARY
2026-01-05 19:19:06,987 - INFO - ================================================================================
2026-01-05 19:19:06,987 - INFO - Total indices: 4
2026-01-05 19:19:06,988 - INFO - Successful: 4
2026-01-05 19:19:06,988 - INFO - Failed: 0
2026-01-05 19:19:06,988 - INFO - 
✓ All indices built successfully!
2026-01-05 19:22:58,378 - INFO - Saving embeddings and IDs...
2026-01-05 19:22:58,498 - INFO - Building FAISS index...
2026-01-05 19:22:59,656 - INFO - BGE Index saved to indices/clapnq/bge-m3/index.faiss
2026-01-05 19:22:59,744 - INFO -   ✓ Index built successfully
2026-01-05 19:22:59,744 - INFO - 
================================================================================
2026-01-05 19:22:59,744 - INFO - Index 2/4: fiqa/bge-m3
2026-01-05 19:22:59,744 - INFO - ================================================================================

2026-01-05 19:22:59,745 - WARNING - Index directory exists but seems incomplete (missing _SUCCESS). Rebuilding: indices/fiqa/bge-m3
2026-01-05 19:22:59,745 - INFO - Building bge-m3 index for fiqa
2026-01-05 19:22:59,745 - INFO -   Corpus: data/passage_level_processed/fiqa/corpus.jsonl
2026-01-05 19:22:59,745 - INFO -   Output: indices/fiqa/bge-m3
2026-01-05 19:23:00,035 - INFO -   Building BGE-M3 index...
2026-01-05 19:23:00,035 - INFO - Initializing BGE Indexer with BAAI/bge-m3 on cuda
2026-01-05 19:23:00,036 - INFO - Load pretrained SentenceTransformer: BAAI/bge-m3
2026-01-05 19:23:03,366 - INFO - Encoding 60984 documents...
2026-01-05 19:23:03,367 - INFO - 🚀 Using 2 GPUs for parallel encoding!
2026-01-05 19:23:03,367 - INFO - Start multi-process pool on devices: cuda:0, cuda:1
2026-01-05 19:24:34,120 - INFO - Saving embeddings and IDs...
2026-01-05 19:24:34,159 - INFO - Building FAISS index...
2026-01-05 19:24:34,557 - INFO - BGE Index saved to indices/fiqa/bge-m3/index.faiss
2026-01-05 19:24:34,588 - INFO -   ✓ Index built successfully
2026-01-05 19:24:34,617 - INFO - 
================================================================================
2026-01-05 19:24:34,618 - INFO - Index 3/4: govt/bge-m3
2026-01-05 19:24:34,618 - INFO - ================================================================================

2026-01-05 19:24:34,619 - WARNING - Index directory exists but seems incomplete (missing _SUCCESS). Rebuilding: indices/govt/bge-m3
2026-01-05 19:24:34,619 - INFO - Building bge-m3 index for govt
2026-01-05 19:24:34,619 - INFO -   Corpus: data/passage_level_processed/govt/corpus.jsonl
2026-01-05 19:24:34,619 - INFO -   Output: indices/govt/bge-m3
2026-01-05 19:24:35,151 - INFO -   Building BGE-M3 index...
2026-01-05 19:24:35,151 - INFO - Initializing BGE Indexer with BAAI/bge-m3 on cuda
2026-01-05 19:24:35,153 - INFO - Load pretrained SentenceTransformer: BAAI/bge-m3
2026-01-05 19:24:38,736 - INFO - Encoding 49607 documents...
2026-01-05 19:24:38,736 - INFO - 🚀 Using 2 GPUs for parallel encoding!
2026-01-05 19:24:38,736 - INFO - Start multi-process pool on devices: cuda:0, cuda:1
2026-01-05 19:26:15,815 - INFO -   Building BM25 index...
2026-01-05 19:26:15,815 - INFO - Initializing BM25 Indexer for clapnq
2026-01-05 19:26:15,815 - INFO - Tokenizing corpus...
2026-01-05 19:27:21,442 - INFO -   Building BGE-M3 index...
2026-01-05 19:27:21,442 - INFO - Initializing BGE Indexer with BAAI/bge-m3 on cuda
2026-01-05 19:27:21,444 - INFO - Load pretrained SentenceTransformer: BAAI/bge-m3
2026-01-05 19:27:24,669 - INFO - Encoding 72439 documents...
2026-01-05 19:27:24,670 - INFO - 🚀 Using 2 GPUs for parallel encoding!
2026-01-05 19:27:24,670 - INFO - Start multi-process pool on devices: cuda:0, cuda:1
2026-01-05 19:27:36,829 - INFO - Building BM25 index...
2026-01-05 19:27:41,838 - INFO - Saving BM25 index to indices/clapnq/bm25/index.pkl...
2026-01-05 19:27:46,676 - INFO - BM25 Indexing complete.
2026-01-05 19:27:47,191 - INFO -   ✓ Index built successfully
2026-01-05 19:27:47,191 - INFO - 
================================================================================
2026-01-05 19:27:47,191 - INFO - SUMMARY
2026-01-05 19:27:47,191 - INFO - ================================================================================
2026-01-05 19:27:47,191 - INFO - Total indices: 1
2026-01-05 19:27:47,192 - INFO - Successful: 1
2026-01-05 19:27:47,192 - INFO - Failed: 0
2026-01-05 19:27:47,192 - INFO - 
✓ All indices built successfully!
2026-01-05 19:29:05,606 - INFO -   Building BM25 index...
2026-01-05 19:29:05,606 - INFO - Initializing BM25 Indexer for clapnq
2026-01-05 19:29:05,606 - INFO - BM25 index already exists for clapnq. Skipping.
2026-01-05 19:29:05,606 - INFO -   ✓ Index built successfully
2026-01-05 19:29:05,606 - INFO - 
================================================================================
2026-01-05 19:29:05,606 - INFO - SUMMARY
2026-01-05 19:29:05,606 - INFO - ================================================================================
2026-01-05 19:29:05,606 - INFO - Total indices: 1
2026-01-05 19:29:05,606 - INFO - Successful: 1
2026-01-05 19:29:05,606 - INFO - Failed: 0
2026-01-05 19:29:05,606 - INFO - 
✓ All indices built successfully!
2026-01-05 19:29:11,919 - INFO -   Building BGE-M3 index...
2026-01-05 19:29:11,920 - INFO - Initializing BGE Indexer with BAAI/bge-m3 on cuda
2026-01-05 19:29:11,921 - INFO - Load pretrained SentenceTransformer: BAAI/bge-m3
2026-01-05 19:29:15,266 - INFO - Encoding 72439 documents...
2026-01-05 19:29:15,266 - INFO - 🚀 Using 2 GPUs for parallel encoding!
2026-01-05 19:29:15,266 - INFO - Start multi-process pool on devices: cuda:0, cuda:1
2026-01-05 19:32:21,624 - INFO -   Building BGE-M3 index...
2026-01-05 19:32:21,624 - INFO - Initializing BGE Indexer with BAAI/bge-m3 on cuda
2026-01-05 19:32:21,626 - INFO - Load pretrained SentenceTransformer: BAAI/bge-m3
2026-01-05 19:32:24,958 - INFO - Encoding 72439 documents...
2026-01-05 19:32:30,446 - ERROR -   ✗ Failed to build index: CUDA out of memory. Tried to allocate 10.99 GiB. GPU 0 has a total capacity of 23.53 GiB of which 10.79 GiB is free. Including non-PyTorch memory, this process has 12.72 GiB memory in use. Of the allocated memory 12.22 GiB is allocated by PyTorch, and 69.12 MiB is reserved by PyTorch but unallocated. If reserved but unallocated memory is large try setting PYTORCH_CUDA_ALLOC_CONF=expandable_segments:True to avoid fragmentation.  See documentation for Memory Management  (https://pytorch.org/docs/stable/notes/cuda.html#environment-variables)
2026-01-05 19:32:30,450 - INFO - 
================================================================================
2026-01-05 19:32:30,450 - INFO - SUMMARY
2026-01-05 19:32:30,451 - INFO - ================================================================================
2026-01-05 19:32:30,451 - INFO - Total indices: 1
2026-01-05 19:32:30,451 - INFO - Successful: 0
2026-01-05 19:32:30,451 - INFO - Failed: 1
2026-01-05 19:32:30,451 - ERROR - 
Failed indices:
2026-01-05 19:32:30,451 - ERROR -   - cloud/bge-m3
2026-01-05 19:32:37,113 - INFO -   Building BGE-M3 index...
2026-01-05 19:32:37,114 - INFO - Initializing BGE Indexer with BAAI/bge-m3 on cuda
2026-01-05 19:32:37,115 - INFO - Load pretrained SentenceTransformer: BAAI/bge-m3
2026-01-05 19:32:40,528 - INFO - Encoding 49607 documents...
2026-01-05 19:32:44,238 - ERROR -   ✗ Failed to build index: CUDA out of memory. Tried to allocate 10.36 GiB. GPU 0 has a total capacity of 23.53 GiB of which 3.03 GiB is free. Including non-PyTorch memory, this process has 20.49 GiB memory in use. Of the allocated memory 19.98 GiB is allocated by PyTorch, and 63.99 MiB is reserved by PyTorch but unallocated. If reserved but unallocated memory is large try setting PYTORCH_CUDA_ALLOC_CONF=expandable_segments:True to avoid fragmentation.  See documentation for Memory Management  (https://pytorch.org/docs/stable/notes/cuda.html#environment-variables)
2026-01-05 19:32:44,242 - INFO - 
================================================================================
2026-01-05 19:32:44,242 - INFO - SUMMARY
2026-01-05 19:32:44,242 - INFO - ================================================================================
2026-01-05 19:32:44,242 - INFO - Total indices: 1
2026-01-05 19:32:44,242 - INFO - Successful: 0
2026-01-05 19:32:44,243 - INFO - Failed: 1
2026-01-05 19:32:44,243 - ERROR - 
Failed indices:
2026-01-05 19:32:44,243 - ERROR -   - govt/bge-m3
2026-01-05 19:35:18,277 - INFO -   Building BGE-M3 index...
2026-01-05 19:35:18,278 - INFO - Initializing BGE Indexer with BAAI/bge-m3 on cuda
2026-01-05 19:35:18,279 - INFO - Load pretrained SentenceTransformer: BAAI/bge-m3
2026-01-05 19:35:21,521 - INFO - Encoding 72439 documents...
2026-01-05 19:39:33,383 - INFO - Saving embeddings and IDs...
2026-01-05 19:39:33,430 - INFO - Building FAISS index...
2026-01-05 19:39:33,885 - INFO - BGE Index saved to indices/cloud/bge-m3/index.faiss
2026-01-05 19:39:33,917 - INFO -   ✓ Index built successfully
2026-01-05 19:39:33,917 - INFO - 
================================================================================
2026-01-05 19:39:33,917 - INFO - SUMMARY
2026-01-05 19:39:33,917 - INFO - ================================================================================
2026-01-05 19:39:33,917 - INFO - Total indices: 1
2026-01-05 19:39:33,917 - INFO - Successful: 1
2026-01-05 19:39:33,917 - INFO - Failed: 0
2026-01-05 19:39:33,917 - INFO - 
✓ All indices built successfully!
2026-01-05 19:39:40,489 - INFO -   Building BGE-M3 index...
2026-01-05 19:39:40,489 - INFO - Initializing BGE Indexer with BAAI/bge-m3 on cuda
2026-01-05 19:39:40,491 - INFO - Load pretrained SentenceTransformer: BAAI/bge-m3
2026-01-05 19:39:43,690 - INFO - Encoding 49607 documents...
2026-01-05 19:42:36,356 - INFO - Saving embeddings and IDs...
2026-01-05 19:42:36,389 - INFO - Building FAISS index...
2026-01-05 19:42:36,700 - INFO - BGE Index saved to indices/govt/bge-m3/index.faiss
2026-01-05 19:42:36,722 - INFO -   ✓ Index built successfully
2026-01-05 19:42:36,722 - INFO - 
================================================================================
2026-01-05 19:42:36,722 - INFO - SUMMARY
2026-01-05 19:42:36,722 - INFO - ================================================================================
2026-01-05 19:42:36,722 - INFO - Total indices: 1
2026-01-05 19:42:36,722 - INFO - Successful: 1
2026-01-05 19:42:36,722 - INFO - Failed: 0
2026-01-05 19:42:36,722 - INFO - 
✓ All indices built successfully!
2026-01-05 19:43:35,845 - INFO -   Building ELSER index...
2026-01-05 19:43:35,846 - INFO - Initializing ELSER Indexer for clapnq at http://localhost:9200
2026-01-05 19:43:35,853 - INFO - HEAD http://localhost:9200/ [status:200 duration:0.007s]
2026-01-05 19:43:35,906 - INFO - PUT http://localhost:9200/_ingest/pipeline/elser-ingest-pipeline [status:200 duration:0.052s]
2026-01-05 19:43:35,906 - INFO - Ingest pipeline elser-ingest-pipeline created/updated.
2026-01-05 19:43:35,910 - INFO - HEAD http://localhost:9200/mt-rag-clapnq-elser [status:404 duration:0.004s]
2026-01-05 19:43:36,042 - INFO - PUT http://localhost:9200/mt-rag-clapnq-elser [status:200 duration:0.132s]
2026-01-05 19:43:36,043 - INFO - Index mt-rag-clapnq-elser created.
2026-01-05 19:43:36,043 - INFO - Bulk indexing 183408 documents to mt-rag-clapnq-elser...
2026-01-05 19:43:36,137 - INFO - PUT http://localhost:9200/_bulk [status:200 duration:0.091s]
2026-01-05 19:43:36,137 - ERROR - ELSER Indexing failed: 100 document(s) failed to index.
2026-01-05 19:43:36,138 - INFO -   ✓ Index built successfully
2026-01-05 19:43:36,138 - INFO - 
================================================================================
2026-01-05 19:43:36,138 - INFO - Index 2/4: fiqa/elser
2026-01-05 19:43:36,138 - INFO - ================================================================================

2026-01-05 19:43:36,138 - WARNING - Index directory exists but seems incomplete (missing _SUCCESS). Rebuilding: indices/fiqa/elser
2026-01-05 19:43:36,138 - INFO - Building elser index for fiqa
2026-01-05 19:43:36,138 - INFO -   Corpus: data/passage_level_processed/fiqa/corpus.jsonl
2026-01-05 19:43:36,138 - INFO -   Output: indices/fiqa/elser
2026-01-05 19:43:36,476 - INFO -   Building ELSER index...
2026-01-05 19:43:36,476 - INFO - Initializing ELSER Indexer for fiqa at http://localhost:9200
2026-01-05 19:43:36,483 - INFO - HEAD http://localhost:9200/ [status:200 duration:0.007s]
2026-01-05 19:43:36,486 - INFO - PUT http://localhost:9200/_ingest/pipeline/elser-ingest-pipeline [status:200 duration:0.002s]
2026-01-05 19:43:36,486 - INFO - Ingest pipeline elser-ingest-pipeline created/updated.
2026-01-05 19:43:36,488 - INFO - HEAD http://localhost:9200/mt-rag-fiqa-elser [status:404 duration:0.002s]
2026-01-05 19:43:36,583 - INFO - PUT http://localhost:9200/mt-rag-fiqa-elser [status:200 duration:0.095s]
2026-01-05 19:43:36,584 - INFO - Index mt-rag-fiqa-elser created.
2026-01-05 19:43:36,584 - INFO - Bulk indexing 60984 documents to mt-rag-fiqa-elser...
2026-01-05 19:43:36,639 - INFO - PUT http://localhost:9200/_bulk [status:200 duration:0.052s]
2026-01-05 19:43:36,639 - ERROR - ELSER Indexing failed: 100 document(s) failed to index.
2026-01-05 19:43:36,639 - INFO -   ✓ Index built successfully
2026-01-05 19:43:36,667 - INFO - 
================================================================================
2026-01-05 19:43:36,668 - INFO - Index 3/4: govt/elser
2026-01-05 19:43:36,668 - INFO - ================================================================================

2026-01-05 19:43:36,668 - WARNING - Index directory exists but seems incomplete (missing _SUCCESS). Rebuilding: indices/govt/elser
2026-01-05 19:43:36,668 - INFO - Building elser index for govt
2026-01-05 19:43:36,668 - INFO -   Corpus: data/passage_level_processed/govt/corpus.jsonl
2026-01-05 19:43:36,668 - INFO -   Output: indices/govt/elser
2026-01-05 19:43:37,242 - INFO -   Building ELSER index...
2026-01-05 19:43:37,242 - INFO - Initializing ELSER Indexer for govt at http://localhost:9200
2026-01-05 19:43:37,250 - INFO - HEAD http://localhost:9200/ [status:200 duration:0.006s]
2026-01-05 19:43:37,252 - INFO - PUT http://localhost:9200/_ingest/pipeline/elser-ingest-pipeline [status:200 duration:0.002s]
2026-01-05 19:43:37,253 - INFO - Ingest pipeline elser-ingest-pipeline created/updated.
2026-01-05 19:43:37,255 - INFO - HEAD http://localhost:9200/mt-rag-govt-elser [status:404 duration:0.002s]
2026-01-05 19:43:37,347 - INFO - PUT http://localhost:9200/mt-rag-govt-elser [status:200 duration:0.092s]
2026-01-05 19:43:37,347 - INFO - Index mt-rag-govt-elser created.
2026-01-05 19:43:37,347 - INFO - Bulk indexing 49607 documents to mt-rag-govt-elser...
2026-01-05 19:43:37,399 - INFO - PUT http://localhost:9200/_bulk [status:200 duration:0.048s]
2026-01-05 19:43:37,399 - ERROR - ELSER Indexing failed: 100 document(s) failed to index.
2026-01-05 19:43:37,399 - INFO -   ✓ Index built successfully
2026-01-05 19:43:37,424 - INFO - 
================================================================================
2026-01-05 19:43:37,424 - INFO - Index 4/4: cloud/elser
2026-01-05 19:43:37,425 - INFO - ================================================================================

2026-01-05 19:43:37,425 - WARNING - Index directory exists but seems incomplete (missing _SUCCESS). Rebuilding: indices/cloud/elser
2026-01-05 19:43:37,425 - INFO - Building elser index for cloud
2026-01-05 19:43:37,425 - INFO -   Corpus: data/passage_level_processed/cloud/corpus.jsonl
2026-01-05 19:43:37,425 - INFO -   Output: indices/cloud/elser
2026-01-05 19:43:38,013 - INFO -   Building ELSER index...
2026-01-05 19:43:38,013 - INFO - Initializing ELSER Indexer for cloud at http://localhost:9200
2026-01-05 19:43:38,020 - INFO - HEAD http://localhost:9200/ [status:200 duration:0.006s]
2026-01-05 19:43:38,022 - INFO - PUT http://localhost:9200/_ingest/pipeline/elser-ingest-pipeline [status:200 duration:0.002s]
2026-01-05 19:43:38,022 - INFO - Ingest pipeline elser-ingest-pipeline created/updated.
2026-01-05 19:43:38,024 - INFO - HEAD http://localhost:9200/mt-rag-cloud-elser [status:404 duration:0.002s]
2026-01-05 19:43:38,108 - INFO - PUT http://localhost:9200/mt-rag-cloud-elser [status:200 duration:0.084s]
2026-01-05 19:43:38,108 - INFO - Index mt-rag-cloud-elser created.
2026-01-05 19:43:38,108 - INFO - Bulk indexing 72439 documents to mt-rag-cloud-elser...
2026-01-05 19:43:38,150 - INFO - PUT http://localhost:9200/_bulk [status:200 duration:0.039s]
2026-01-05 19:43:38,150 - ERROR - ELSER Indexing failed: 100 document(s) failed to index.
2026-01-05 19:43:38,150 - INFO -   ✓ Index built successfully
2026-01-05 19:43:38,182 - INFO - 
================================================================================
2026-01-05 19:43:38,182 - INFO - SUMMARY
2026-01-05 19:43:38,182 - INFO - ================================================================================
2026-01-05 19:43:38,182 - INFO - Total indices: 4
2026-01-05 19:43:38,182 - INFO - Successful: 4
2026-01-05 19:43:38,182 - INFO - Failed: 0
2026-01-05 19:43:38,182 - INFO - 
✓ All indices built successfully!
2026-01-05 19:50:27,705 - INFO -   Building BGE-base-en-v1.5 index (baseline)...
2026-01-05 19:50:27,705 - INFO - Initializing BGE Indexer with BAAI/bge-base-en-v1.5 on cuda
2026-01-05 19:50:27,707 - INFO - Load pretrained SentenceTransformer: BAAI/bge-base-en-v1.5
2026-01-05 19:50:34,253 - INFO - Encoding 183408 documents...
2026-01-05 19:54:05,013 - INFO - Saving embeddings and IDs...
2026-01-05 19:54:05,118 - INFO - Building FAISS index...
2026-01-05 19:54:06,015 - INFO - BGE Index saved to indices/clapnq/bge/index.faiss
2026-01-05 19:54:06,091 - INFO -   ✓ Index built successfully
2026-01-05 19:54:06,091 - INFO - 
================================================================================
2026-01-05 19:54:06,091 - INFO - SUMMARY
2026-01-05 19:54:06,091 - INFO - ================================================================================
2026-01-05 19:54:06,091 - INFO - Total indices: 1
2026-01-05 19:54:06,091 - INFO - Successful: 1
2026-01-05 19:54:06,092 - INFO - Failed: 0
2026-01-05 19:54:06,092 - INFO - 
✓ All indices built successfully!
2026-01-05 19:54:12,448 - INFO -   Building BGE-base-en-v1.5 index (baseline)...
2026-01-05 19:54:12,449 - INFO - Initializing BGE Indexer with BAAI/bge-base-en-v1.5 on cuda
2026-01-05 19:54:12,451 - INFO - Load pretrained SentenceTransformer: BAAI/bge-base-en-v1.5
2026-01-05 19:54:14,000 - INFO - Encoding 72439 documents...
2026-01-05 19:56:10,930 - INFO - Saving embeddings and IDs...
2026-01-05 19:56:10,971 - INFO - Building FAISS index...
2026-01-05 19:56:11,315 - INFO - BGE Index saved to indices/cloud/bge/index.faiss
2026-01-05 19:56:11,340 - INFO -   ✓ Index built successfully
2026-01-05 19:56:11,340 - INFO - 
================================================================================
2026-01-05 19:56:11,340 - INFO - SUMMARY
2026-01-05 19:56:11,340 - INFO - ================================================================================
2026-01-05 19:56:11,340 - INFO - Total indices: 1
2026-01-05 19:56:11,340 - INFO - Successful: 1
2026-01-05 19:56:11,340 - INFO - Failed: 0
2026-01-05 19:56:11,340 - INFO - 
✓ All indices built successfully!
2026-01-05 19:56:17,283 - INFO -   Building BGE-base-en-v1.5 index (baseline)...
2026-01-05 19:56:17,283 - INFO - Initializing BGE Indexer with BAAI/bge-base-en-v1.5 on cuda
2026-01-05 19:56:17,285 - INFO - Load pretrained SentenceTransformer: BAAI/bge-base-en-v1.5
2026-01-05 19:56:18,702 - INFO - Encoding 60984 documents...
2026-01-05 19:57:32,439 - INFO - Saving embeddings and IDs...
2026-01-05 19:57:32,476 - INFO - Building FAISS index...
2026-01-05 19:57:32,763 - INFO - BGE Index saved to indices/fiqa/bge/index.faiss
2026-01-05 19:57:32,783 - INFO -   ✓ Index built successfully
2026-01-05 19:57:32,784 - INFO - 
================================================================================
2026-01-05 19:57:32,784 - INFO - SUMMARY
2026-01-05 19:57:32,784 - INFO - ================================================================================
2026-01-05 19:57:32,784 - INFO - Total indices: 1
2026-01-05 19:57:32,784 - INFO - Successful: 1
2026-01-05 19:57:32,784 - INFO - Failed: 0
2026-01-05 19:57:32,784 - INFO - 
✓ All indices built successfully!
2026-01-05 19:57:38,974 - INFO -   Building BGE-base-en-v1.5 index (baseline)...
2026-01-05 19:57:38,974 - INFO - Initializing BGE Indexer with BAAI/bge-base-en-v1.5 on cuda
2026-01-05 19:57:38,976 - INFO - Load pretrained SentenceTransformer: BAAI/bge-base-en-v1.5
2026-01-05 19:57:40,427 - INFO - Encoding 49607 documents...
2026-01-05 19:58:59,974 - INFO - Saving embeddings and IDs...
2026-01-05 19:59:00,003 - INFO - Building FAISS index...
2026-01-05 19:59:00,237 - INFO - BGE Index saved to indices/govt/bge/index.faiss
2026-01-05 19:59:00,254 - INFO -   ✓ Index built successfully
2026-01-05 19:59:00,255 - INFO - 
================================================================================
2026-01-05 19:59:00,255 - INFO - SUMMARY
2026-01-05 19:59:00,255 - INFO - ================================================================================
2026-01-05 19:59:00,255 - INFO - Total indices: 1
2026-01-05 19:59:00,255 - INFO - Successful: 1
2026-01-05 19:59:00,255 - INFO - Failed: 0
2026-01-05 19:59:00,255 - INFO - 
✓ All indices built successfully!
2026-01-05 20:21:17,392 - INFO -   Building BM25 index...
2026-01-05 20:21:17,392 - INFO - Initializing BM25 Indexer for clapnq
2026-01-05 20:21:17,392 - INFO - Tokenizing corpus...
2026-01-05 20:24:11,200 - INFO -   Building ELSER index...
2026-01-05 20:24:11,201 - INFO - Initializing ELSER Indexer for clapnq at http://localhost:9200
2026-01-05 20:24:11,205 - INFO - HEAD http://localhost:9200/ [status:200 duration:0.004s]
2026-01-05 20:24:11,207 - INFO - PUT http://localhost:9200/_ingest/pipeline/elser-ingest-pipeline [status:200 duration:0.002s]
2026-01-05 20:24:11,207 - INFO - Ingest pipeline elser-ingest-pipeline created/updated.
2026-01-05 20:24:11,213 - INFO - HEAD http://localhost:9200/mt-rag-clapnq-elser [status:200 duration:0.005s]
2026-01-05 20:24:11,213 - INFO - Index mt-rag-clapnq-elser already exists. Appending/Overwriting.
2026-01-05 20:24:11,213 - INFO - Bulk indexing 183408 documents to mt-rag-clapnq-elser...
2026-01-05 20:24:21,226 - INFO - PUT http://localhost:9200/_bulk [status:N/A duration:10.011s]
2026-01-05 20:24:21,226 - WARNING - Node <Urllib3HttpNode(http://localhost:9200)> has failed for 1 times in a row, putting on 1 second timeout
2026-01-05 20:24:21,226 - ERROR - ELSER Indexing failed: Connection timed out
2026-01-05 20:24:21,226 - INFO -   ✓ Index built successfully
2026-01-05 20:24:21,226 - INFO - 
================================================================================
2026-01-05 20:24:21,227 - INFO - Index 2/4: fiqa/elser
2026-01-05 20:24:21,227 - INFO - ================================================================================

2026-01-05 20:24:21,227 - INFO - Building elser index for fiqa
2026-01-05 20:24:21,227 - INFO -   Corpus: data/passage_level_processed/fiqa/corpus.jsonl
2026-01-05 20:24:21,227 - INFO -   Output: indices/fiqa/elser
2026-01-05 20:24:21,546 - INFO -   Building ELSER index...
2026-01-05 20:24:21,546 - INFO - Initializing ELSER Indexer for fiqa at http://localhost:9200
2026-01-05 20:24:21,550 - INFO - HEAD http://localhost:9200/ [status:200 duration:0.004s]
2026-01-05 20:24:21,552 - INFO - PUT http://localhost:9200/_ingest/pipeline/elser-ingest-pipeline [status:200 duration:0.002s]
2026-01-05 20:24:21,552 - INFO - Ingest pipeline elser-ingest-pipeline created/updated.
2026-01-05 20:24:21,555 - INFO - HEAD http://localhost:9200/mt-rag-fiqa-elser [status:200 duration:0.002s]
2026-01-05 20:24:21,555 - INFO - Index mt-rag-fiqa-elser already exists. Appending/Overwriting.
2026-01-05 20:24:21,555 - INFO - Bulk indexing 60984 documents to mt-rag-fiqa-elser...
2026-01-05 20:24:31,568 - INFO - PUT http://localhost:9200/_bulk [status:N/A duration:10.011s]
2026-01-05 20:24:31,568 - WARNING - Node <Urllib3HttpNode(http://localhost:9200)> has failed for 1 times in a row, putting on 1 second timeout
2026-01-05 20:24:31,568 - ERROR - ELSER Indexing failed: Connection timed out
2026-01-05 20:24:31,568 - INFO -   ✓ Index built successfully
2026-01-05 20:24:31,568 - INFO - 
================================================================================
2026-01-05 20:24:31,568 - INFO - Index 3/4: govt/elser
2026-01-05 20:24:31,568 - INFO - ================================================================================

2026-01-05 20:24:31,568 - INFO - Building elser index for govt
2026-01-05 20:24:31,568 - INFO -   Corpus: data/passage_level_processed/govt/corpus.jsonl
2026-01-05 20:24:31,568 - INFO -   Output: indices/govt/elser
2026-01-05 20:24:32,167 - INFO -   Building ELSER index...
2026-01-05 20:24:32,167 - INFO - Initializing ELSER Indexer for govt at http://localhost:9200
2026-01-05 20:24:32,172 - INFO - HEAD http://localhost:9200/ [status:200 duration:0.004s]
2026-01-05 20:24:32,174 - INFO - PUT http://localhost:9200/_ingest/pipeline/elser-ingest-pipeline [status:200 duration:0.002s]
2026-01-05 20:24:32,174 - INFO - Ingest pipeline elser-ingest-pipeline created/updated.
2026-01-05 20:24:32,176 - INFO - HEAD http://localhost:9200/mt-rag-govt-elser [status:200 duration:0.002s]
2026-01-05 20:24:32,176 - INFO - Index mt-rag-govt-elser already exists. Appending/Overwriting.
2026-01-05 20:24:32,176 - INFO - Bulk indexing 49607 documents to mt-rag-govt-elser...
2026-01-05 20:24:42,190 - INFO - PUT http://localhost:9200/_bulk [status:N/A duration:10.011s]
2026-01-05 20:24:42,191 - WARNING - Node <Urllib3HttpNode(http://localhost:9200)> has failed for 1 times in a row, putting on 1 second timeout
2026-01-05 20:24:42,191 - ERROR - ELSER Indexing failed: Connection timed out
2026-01-05 20:24:42,191 - INFO -   ✓ Index built successfully
2026-01-05 20:24:42,191 - INFO - 
================================================================================
2026-01-05 20:24:42,191 - INFO - Index 4/4: cloud/elser
2026-01-05 20:24:42,191 - INFO - ================================================================================

2026-01-05 20:24:42,191 - INFO - Building elser index for cloud
2026-01-05 20:24:42,191 - INFO -   Corpus: data/passage_level_processed/cloud/corpus.jsonl
2026-01-05 20:24:42,192 - INFO -   Output: indices/cloud/elser
2026-01-05 20:24:42,796 - INFO -   Building ELSER index...
2026-01-05 20:24:42,796 - INFO - Initializing ELSER Indexer for cloud at http://localhost:9200
2026-01-05 20:24:42,801 - INFO - HEAD http://localhost:9200/ [status:200 duration:0.004s]
2026-01-05 20:24:42,803 - INFO - PUT http://localhost:9200/_ingest/pipeline/elser-ingest-pipeline [status:200 duration:0.002s]
2026-01-05 20:24:42,803 - INFO - Ingest pipeline elser-ingest-pipeline created/updated.
2026-01-05 20:24:42,806 - INFO - HEAD http://localhost:9200/mt-rag-cloud-elser [status:200 duration:0.002s]
2026-01-05 20:24:42,806 - INFO - Index mt-rag-cloud-elser already exists. Appending/Overwriting.
2026-01-05 20:24:42,806 - INFO - Bulk indexing 72439 documents to mt-rag-cloud-elser...
2026-01-05 20:24:52,819 - INFO - PUT http://localhost:9200/_bulk [status:N/A duration:10.011s]
2026-01-05 20:24:52,819 - WARNING - Node <Urllib3HttpNode(http://localhost:9200)> has failed for 1 times in a row, putting on 1 second timeout
2026-01-05 20:24:52,819 - ERROR - ELSER Indexing failed: Connection timed out
2026-01-05 20:24:52,820 - INFO -   ✓ Index built successfully
2026-01-05 20:24:52,820 - INFO - 
================================================================================
2026-01-05 20:24:52,820 - INFO - SUMMARY
2026-01-05 20:24:52,820 - INFO - ================================================================================
2026-01-05 20:24:52,820 - INFO - Total indices: 4
2026-01-05 20:24:52,820 - INFO - Successful: 4
2026-01-05 20:24:52,820 - INFO - Failed: 0
2026-01-05 20:24:52,820 - INFO - 
✓ All indices built successfully!
2026-01-05 20:26:30,711 - INFO -   Building ELSER index...
2026-01-05 20:26:30,712 - INFO - Initializing ELSER Indexer for clapnq at http://localhost:9200
2026-01-05 20:26:30,717 - INFO - HEAD http://localhost:9200/ [status:200 duration:0.004s]
2026-01-05 20:26:30,719 - INFO - PUT http://localhost:9200/_ingest/pipeline/elser-ingest-pipeline [status:200 duration:0.001s]
2026-01-05 20:26:30,719 - INFO - Ingest pipeline elser-ingest-pipeline created/updated.
2026-01-05 20:26:30,720 - INFO - HEAD http://localhost:9200/mt-rag-clapnq-elser [status:404 duration:0.002s]
2026-01-05 20:26:30,806 - INFO - PUT http://localhost:9200/mt-rag-clapnq-elser [status:200 duration:0.086s]
2026-01-05 20:26:30,806 - INFO - Index mt-rag-clapnq-elser created.
2026-01-05 20:26:30,806 - INFO - Bulk indexing 183408 documents to mt-rag-clapnq-elser...
2026-01-05 20:30:42,620 - INFO - PUT http://localhost:9200/_bulk [status:200 duration:251.740s]
2026-01-05 20:30:42,620 - ERROR - ELSER Indexing failed: 10 document(s) failed to index.
2026-01-05 20:30:42,620 - INFO -   ✓ Index built successfully
2026-01-05 20:30:42,620 - INFO - 
================================================================================
2026-01-05 20:30:42,621 - INFO - Index 2/4: fiqa/elser
2026-01-05 20:30:42,621 - INFO - ================================================================================

2026-01-05 20:30:42,621 - INFO - Building elser index for fiqa
2026-01-05 20:30:42,621 - INFO -   Corpus: data/passage_level_processed/fiqa/corpus.jsonl
2026-01-05 20:30:42,621 - INFO -   Output: indices/fiqa/elser
2026-01-05 20:30:42,941 - INFO -   Building ELSER index...
2026-01-05 20:30:42,941 - INFO - Initializing ELSER Indexer for fiqa at http://localhost:9200
2026-01-05 20:30:42,946 - INFO - HEAD http://localhost:9200/ [status:200 duration:0.004s]
2026-01-05 20:30:42,948 - INFO - PUT http://localhost:9200/_ingest/pipeline/elser-ingest-pipeline [status:200 duration:0.002s]
2026-01-05 20:30:42,948 - INFO - Ingest pipeline elser-ingest-pipeline created/updated.
2026-01-05 20:30:42,949 - INFO - HEAD http://localhost:9200/mt-rag-fiqa-elser [status:404 duration:0.001s]
2026-01-05 20:30:43,079 - INFO - PUT http://localhost:9200/mt-rag-fiqa-elser [status:200 duration:0.129s]
2026-01-05 20:30:43,079 - INFO - Index mt-rag-fiqa-elser created.
2026-01-05 20:30:43,079 - INFO - Bulk indexing 60984 documents to mt-rag-fiqa-elser...
2026-01-05 20:30:43,145 - INFO - PUT http://localhost:9200/_bulk [status:200 duration:0.064s]
2026-01-05 20:30:43,146 - ERROR - ELSER Indexing failed: 10 document(s) failed to index.
2026-01-05 20:30:43,146 - INFO -   ✓ Index built successfully
2026-01-05 20:30:43,174 - INFO - 
================================================================================
2026-01-05 20:30:43,175 - INFO - Index 3/4: govt/elser
2026-01-05 20:30:43,175 - INFO - ================================================================================

2026-01-05 20:30:43,175 - INFO - Building elser index for govt
2026-01-05 20:30:43,175 - INFO -   Corpus: data/passage_level_processed/govt/corpus.jsonl
2026-01-05 20:30:43,175 - INFO -   Output: indices/govt/elser
2026-01-05 20:30:43,770 - INFO -   Building ELSER index...
2026-01-05 20:30:43,770 - INFO - Initializing ELSER Indexer for govt at http://localhost:9200
2026-01-05 20:30:43,774 - INFO - HEAD http://localhost:9200/ [status:200 duration:0.004s]
2026-01-05 20:30:43,776 - INFO - PUT http://localhost:9200/_ingest/pipeline/elser-ingest-pipeline [status:200 duration:0.002s]
2026-01-05 20:30:43,776 - INFO - Ingest pipeline elser-ingest-pipeline created/updated.
2026-01-05 20:30:43,778 - INFO - HEAD http://localhost:9200/mt-rag-govt-elser [status:200 duration:0.002s]
2026-01-05 20:30:43,778 - INFO - Index mt-rag-govt-elser already exists. Appending/Overwriting.
2026-01-05 20:30:43,778 - INFO - Bulk indexing 49607 documents to mt-rag-govt-elser...
2026-01-05 20:30:43,861 - INFO - PUT http://localhost:9200/_bulk [status:200 duration:0.081s]
2026-01-05 20:30:43,924 - INFO - PUT http://localhost:9200/_bulk [status:200 duration:0.061s]
2026-01-05 20:30:43,924 - ERROR - ELSER Indexing failed: 10 document(s) failed to index.
2026-01-05 20:30:43,924 - INFO -   ✓ Index built successfully
2026-01-05 20:30:43,949 - INFO - 
================================================================================
2026-01-05 20:30:43,949 - INFO - Index 4/4: cloud/elser
2026-01-05 20:30:43,949 - INFO - ================================================================================

2026-01-05 20:30:43,949 - INFO - Building elser index for cloud
2026-01-05 20:30:43,949 - INFO -   Corpus: data/passage_level_processed/cloud/corpus.jsonl
2026-01-05 20:30:43,949 - INFO -   Output: indices/cloud/elser
2026-01-05 20:30:44,529 - INFO -   Building ELSER index...
2026-01-05 20:30:44,529 - INFO - Initializing ELSER Indexer for cloud at http://localhost:9200
2026-01-05 20:30:44,534 - INFO - HEAD http://localhost:9200/ [status:200 duration:0.004s]
2026-01-05 20:30:44,536 - INFO - PUT http://localhost:9200/_ingest/pipeline/elser-ingest-pipeline [status:200 duration:0.002s]
2026-01-05 20:30:44,536 - INFO - Ingest pipeline elser-ingest-pipeline created/updated.
2026-01-05 20:30:44,538 - INFO - HEAD http://localhost:9200/mt-rag-cloud-elser [status:200 duration:0.002s]
2026-01-05 20:30:44,538 - INFO - Index mt-rag-cloud-elser already exists. Appending/Overwriting.
2026-01-05 20:30:44,538 - INFO - Bulk indexing 72439 documents to mt-rag-cloud-elser...
2026-01-05 20:30:44,594 - INFO - PUT http://localhost:9200/_bulk [status:200 duration:0.054s]
2026-01-05 20:30:44,594 - ERROR - ELSER Indexing failed: 1 document(s) failed to index.
2026-01-05 20:30:44,594 - INFO -   ✓ Index built successfully
2026-01-05 20:30:44,627 - INFO - 
================================================================================
2026-01-05 20:30:44,627 - INFO - SUMMARY
2026-01-05 20:30:44,628 - INFO - ================================================================================
2026-01-05 20:30:44,628 - INFO - Total indices: 4
2026-01-05 20:30:44,628 - INFO - Successful: 4
2026-01-05 20:30:44,628 - INFO - Failed: 0
2026-01-05 20:30:44,628 - INFO - 
✓ All indices built successfully!
2026-01-05 20:32:26,246 - INFO -   Building ELSER index...
2026-01-05 20:32:26,247 - INFO - Initializing ELSER Indexer for clapnq at http://localhost:9200
2026-01-05 20:32:26,252 - INFO - HEAD http://localhost:9200/ [status:200 duration:0.004s]
2026-01-05 20:32:26,254 - INFO - PUT http://localhost:9200/_ingest/pipeline/elser-ingest-pipeline [status:200 duration:0.002s]
2026-01-05 20:32:26,254 - INFO - Ingest pipeline elser-ingest-pipeline created/updated.
2026-01-05 20:32:26,256 - INFO - HEAD http://localhost:9200/mt-rag-clapnq-elser [status:404 duration:0.001s]
2026-01-05 20:32:26,327 - INFO - PUT http://localhost:9200/mt-rag-clapnq-elser [status:200 duration:0.071s]
2026-01-05 20:32:26,327 - INFO - Index mt-rag-clapnq-elser created.
2026-01-05 20:32:26,327 - INFO - Bulk indexing 183408 documents to mt-rag-clapnq-elser...
2026-01-05 20:33:04,744 - INFO - PUT http://localhost:9200/_bulk [status:200 duration:38.129s]
2026-01-05 20:33:05,599 - INFO - PUT http://localhost:9200/_bulk [status:200 duration:38.981s]
2026-01-05 20:33:06,560 - INFO - PUT http://localhost:9200/_bulk [status:200 duration:39.944s]
2026-01-05 20:33:08,243 - INFO - PUT http://localhost:9200/_bulk [status:200 duration:41.624s]
2026-01-05 20:33:33,344 - INFO - PUT http://localhost:9200/_bulk [status:200 duration:28.595s]
2026-01-05 20:33:56,461 - INFO - PUT http://localhost:9200/_bulk [status:200 duration:50.857s]
2026-01-05 20:34:23,219 - INFO - PUT http://localhost:9200/_bulk [status:200 duration:76.653s]
2026-01-05 20:34:48,395 - INFO - PUT http://localhost:9200/_bulk [status:200 duration:100.147s]
2026-01-05 20:35:13,183 - INFO - PUT http://localhost:9200/_bulk [status:200 duration:99.835s]
2026-01-05 22:22:24,224 - INFO -   Building SPLADE index...
2026-01-05 22:22:24,224 - INFO - Initializing SPLADE Indexer with naver/splade-v3
2026-01-05 22:22:24,378 - ERROR -   ✗ Failed to build index: You are trying to access a gated repo.
Make sure to have access to it at https://huggingface.co/naver/splade-v3.
403 Client Error. (Request ID: Root=1-695c39a0-7480394578f21ffb270512ca;9254f091-5201-43ff-b867-c25b622f81df)

Cannot access gated repo for url https://huggingface.co/naver/splade-v3/resolve/main/config.json.
Access to model naver/splade-v3 is restricted and you are not in the authorized list. Visit https://huggingface.co/naver/splade-v3 to ask for access.
2026-01-05 22:22:24,382 - INFO - 
================================================================================
2026-01-05 22:22:24,383 - INFO - Index 6/20: fiqa/bm25
2026-01-05 22:22:24,383 - INFO - ================================================================================

2026-01-05 22:22:24,383 - INFO - Index already exists and is complete (use --force to rebuild): indices/fiqa/bm25
2026-01-05 22:22:24,383 - INFO - 
================================================================================
2026-01-05 22:22:24,383 - INFO - Index 7/20: fiqa/elser
2026-01-05 22:22:24,383 - INFO - ================================================================================

2026-01-05 22:22:24,383 - INFO - Index already exists and is complete (use --force to rebuild): indices/fiqa/elser
2026-01-05 22:22:24,383 - INFO - 
================================================================================
2026-01-05 22:22:24,383 - INFO - Index 8/20: fiqa/bge-m3
2026-01-05 22:22:24,383 - INFO - ================================================================================

2026-01-05 22:22:24,384 - INFO - Index already exists and is complete (use --force to rebuild): indices/fiqa/bge-m3
2026-01-05 22:22:24,384 - INFO - 
================================================================================
2026-01-05 22:22:24,384 - INFO - Index 9/20: fiqa/bge-base-1.5
2026-01-05 22:22:24,384 - INFO - ================================================================================

2026-01-05 22:22:24,384 - INFO - Index already exists and is complete (use --force to rebuild): indices/fiqa/bge-base-1.5
2026-01-05 22:22:24,384 - INFO - 
================================================================================
2026-01-05 22:22:24,384 - INFO - Index 10/20: fiqa/splade
2026-01-05 22:22:24,384 - INFO - ================================================================================

2026-01-05 22:22:24,384 - WARNING - Index directory exists but seems incomplete (missing _SUCCESS). Rebuilding: indices/fiqa/splade
2026-01-05 22:22:24,384 - INFO - Building splade index for fiqa
2026-01-05 22:22:24,385 - INFO -   Corpus: data/passage_level_processed/fiqa/corpus.jsonl
2026-01-05 22:22:24,385 - INFO -   Output: indices/fiqa/splade
2026-01-05 22:22:24,735 - INFO -   Building SPLADE index...
2026-01-05 22:22:24,736 - INFO - Initializing SPLADE Indexer with naver/splade-v3
2026-01-05 22:22:25,093 - ERROR -   ✗ Failed to build index: You are trying to access a gated repo.
Make sure to have access to it at https://huggingface.co/naver/splade-v3.
403 Client Error. (Request ID: Root=1-695c39a1-385d62017e1abdff1ecdb245;92ed8c75-7870-470a-9858-197234747350)

Cannot access gated repo for url https://huggingface.co/naver/splade-v3/resolve/main/config.json.
Access to model naver/splade-v3 is restricted and you are not in the authorized list. Visit https://huggingface.co/naver/splade-v3 to ask for access.
2026-01-05 22:22:25,094 - INFO - 
================================================================================
2026-01-05 22:22:25,094 - INFO - Index 11/20: govt/bm25
2026-01-05 22:22:25,094 - INFO - ================================================================================

2026-01-05 22:22:25,094 - INFO - Index already exists and is complete (use --force to rebuild): indices/govt/bm25
2026-01-05 22:22:25,095 - INFO - 
================================================================================
2026-01-05 22:22:25,095 - INFO - Index 12/20: govt/elser
2026-01-05 22:22:25,095 - INFO - ================================================================================

2026-01-05 22:22:25,095 - INFO - Index already exists and is complete (use --force to rebuild): indices/govt/elser
2026-01-05 22:22:25,095 - INFO - 
================================================================================
2026-01-05 22:22:25,095 - INFO - Index 13/20: govt/bge-m3
2026-01-05 22:22:25,095 - INFO - ================================================================================

2026-01-05 22:22:25,095 - INFO - Index already exists and is complete (use --force to rebuild): indices/govt/bge-m3
2026-01-05 22:22:25,095 - INFO - 
================================================================================
2026-01-05 22:22:25,095 - INFO - Index 14/20: govt/bge-base-1.5
2026-01-05 22:22:25,095 - INFO - ================================================================================

2026-01-05 22:22:25,095 - INFO - Index already exists and is complete (use --force to rebuild): indices/govt/bge-base-1.5
2026-01-05 22:22:25,095 - INFO - 
================================================================================
2026-01-05 22:22:25,095 - INFO - Index 15/20: govt/splade
2026-01-05 22:22:25,095 - INFO - ================================================================================

2026-01-05 22:22:25,095 - WARNING - Index directory exists but seems incomplete (missing _SUCCESS). Rebuilding: indices/govt/splade
2026-01-05 22:22:25,095 - INFO - Building splade index for govt
2026-01-05 22:22:25,096 - INFO -   Corpus: data/passage_level_processed/govt/corpus.jsonl
2026-01-05 22:22:25,096 - INFO -   Output: indices/govt/splade
2026-01-05 22:22:25,695 - INFO -   Building SPLADE index...
2026-01-05 22:22:25,695 - INFO - Initializing SPLADE Indexer with naver/splade-v3
2026-01-05 22:22:25,818 - ERROR -   ✗ Failed to build index: You are trying to access a gated repo.
Make sure to have access to it at https://huggingface.co/naver/splade-v3.
403 Client Error. (Request ID: Root=1-695c39a1-07b1db2e69b979565d509c9b;549c3c52-0d44-4618-80fc-12f1ae18d375)

Cannot access gated repo for url https://huggingface.co/naver/splade-v3/resolve/main/config.json.
Access to model naver/splade-v3 is restricted and you are not in the authorized list. Visit https://huggingface.co/naver/splade-v3 to ask for access.
2026-01-05 22:22:25,820 - INFO - 
================================================================================
2026-01-05 22:22:25,820 - INFO - Index 16/20: cloud/bm25
2026-01-05 22:22:25,820 - INFO - ================================================================================

2026-01-05 22:22:25,820 - INFO - Index already exists and is complete (use --force to rebuild): indices/cloud/bm25
2026-01-05 22:22:25,820 - INFO - 
================================================================================
2026-01-05 22:22:25,820 - INFO - Index 17/20: cloud/elser
2026-01-05 22:22:25,820 - INFO - ================================================================================

2026-01-05 22:22:25,820 - INFO - Index already exists and is complete (use --force to rebuild): indices/cloud/elser
2026-01-05 22:22:25,820 - INFO - 
================================================================================
2026-01-05 22:22:25,820 - INFO - Index 18/20: cloud/bge-m3
2026-01-05 22:22:25,820 - INFO - ================================================================================

2026-01-05 22:22:25,820 - INFO - Index already exists and is complete (use --force to rebuild): indices/cloud/bge-m3
2026-01-05 22:22:25,820 - INFO - 
================================================================================
2026-01-05 22:22:25,821 - INFO - Index 19/20: cloud/bge-base-1.5
2026-01-05 22:22:25,821 - INFO - ================================================================================

2026-01-05 22:22:25,821 - INFO - Index already exists and is complete (use --force to rebuild): indices/cloud/bge-base-1.5
2026-01-05 22:22:25,821 - INFO - 
================================================================================
2026-01-05 22:22:25,821 - INFO - Index 20/20: cloud/splade
2026-01-05 22:22:25,821 - INFO - ================================================================================

2026-01-05 22:22:25,821 - WARNING - Index directory exists but seems incomplete (missing _SUCCESS). Rebuilding: indices/cloud/splade
2026-01-05 22:22:25,821 - INFO - Building splade index for cloud
2026-01-05 22:22:25,821 - INFO -   Corpus: data/passage_level_processed/cloud/corpus.jsonl
2026-01-05 22:22:25,821 - INFO -   Output: indices/cloud/splade
2026-01-05 22:22:26,433 - INFO -   Building SPLADE index...
2026-01-05 22:22:26,433 - INFO - Initializing SPLADE Indexer with naver/splade-v3
2026-01-05 22:22:26,568 - ERROR -   ✗ Failed to build index: You are trying to access a gated repo.
Make sure to have access to it at https://huggingface.co/naver/splade-v3.
403 Client Error. (Request ID: Root=1-695c39a2-664b9551168f5ea972fc191f;21d59836-a7f6-431f-85a5-0a4cceb40066)

Cannot access gated repo for url https://huggingface.co/naver/splade-v3/resolve/main/config.json.
Access to model naver/splade-v3 is restricted and you are not in the authorized list. Visit https://huggingface.co/naver/splade-v3 to ask for access.
2026-01-05 22:22:26,569 - INFO - 
================================================================================
2026-01-05 22:22:26,569 - INFO - SUMMARY
2026-01-05 22:22:26,569 - INFO - ================================================================================
2026-01-05 22:22:26,569 - INFO - Total indices: 20
2026-01-05 22:22:26,569 - INFO - Successful: 16
2026-01-05 22:22:26,569 - INFO - Failed: 4
2026-01-05 22:22:26,570 - ERROR - 
Failed indices:
2026-01-05 22:22:26,570 - ERROR -   - clapnq/splade
2026-01-05 22:22:26,570 - ERROR -   - fiqa/splade
2026-01-05 22:22:26,570 - ERROR -   - govt/splade
2026-01-05 22:22:26,570 - ERROR -   - cloud/splade
2026-01-05 22:23:32,400 - INFO -   Building SPLADE index...
2026-01-05 22:23:32,401 - INFO - Initializing SPLADE Indexer with naver/splade-cocondenser-ensembledistil
2026-01-05 22:23:36,124 - INFO - Encoding 183408 documents with SPLADE...
2026-01-05 22:24:11,126 - INFO -   Building SPLADE index...
2026-01-05 22:24:11,126 - INFO - Initializing SPLADE Indexer with naver/splade-cocondenser-ensembledistil
2026-01-05 22:24:12,058 - INFO - Encoding 183408 documents with SPLADE...
2026-01-05 22:25:25,513 - INFO -   Building SPLADE index...
2026-01-05 22:25:25,513 - INFO - Initializing SPLADE Indexer with naver/splade-cocondenser-ensembledistil
2026-01-05 22:25:26,368 - INFO - Encoding 183408 documents with SPLADE...
2026-01-05 22:29:47,631 - INFO -   Building SPLADE index...
2026-01-05 22:29:47,631 - INFO - Initializing SPLADE Indexer with naver/splade-cocondenser-ensembledistil
2026-01-05 22:29:48,506 - INFO - 🚀 Using 2 GPUs for SPLADE encoding!
2026-01-05 22:29:48,507 - INFO - Encoding 183408 documents with SPLADE...
2026-01-05 22:48:25,634 - INFO - Saving SPLADE index to indices/clapnq/splade/index.npz...
2026-01-05 22:48:39,477 - INFO - SPLADE Indexing complete.
2026-01-05 22:48:41,642 - INFO -   ✓ Index built successfully
2026-01-05 22:48:41,643 - INFO - 
================================================================================
2026-01-05 22:48:41,643 - INFO - Index 6/20: fiqa/bm25
2026-01-05 22:48:41,643 - INFO - ================================================================================

2026-01-05 22:48:41,643 - INFO - Index already exists and is complete (use --force to rebuild): indices/fiqa/bm25
2026-01-05 22:48:41,644 - INFO - 
================================================================================
2026-01-05 22:48:41,644 - INFO - Index 7/20: fiqa/elser
2026-01-05 22:48:41,644 - INFO - ================================================================================

2026-01-05 22:48:41,644 - INFO - Index already exists and is complete (use --force to rebuild): indices/fiqa/elser
2026-01-05 22:48:41,644 - INFO - 
================================================================================
2026-01-05 22:48:41,644 - INFO - Index 8/20: fiqa/bge-m3
2026-01-05 22:48:41,644 - INFO - ================================================================================

2026-01-05 22:48:41,644 - INFO - Index already exists and is complete (use --force to rebuild): indices/fiqa/bge-m3
2026-01-05 22:48:41,644 - INFO - 
================================================================================
2026-01-05 22:48:41,644 - INFO - Index 9/20: fiqa/bge-base-1.5
2026-01-05 22:48:41,644 - INFO - ================================================================================

2026-01-05 22:48:41,644 - INFO - Index already exists and is complete (use --force to rebuild): indices/fiqa/bge-base-1.5
2026-01-05 22:48:41,644 - INFO - 
================================================================================
2026-01-05 22:48:41,644 - INFO - Index 10/20: fiqa/splade
2026-01-05 22:48:41,644 - INFO - ================================================================================

2026-01-05 22:48:41,645 - WARNING - Index directory exists but seems incomplete (missing _SUCCESS). Rebuilding: indices/fiqa/splade
2026-01-05 22:48:41,645 - INFO - Building splade index for fiqa
2026-01-05 22:48:41,645 - INFO -   Corpus: data/passage_level_processed/fiqa/corpus.jsonl
2026-01-05 22:48:41,645 - INFO -   Output: indices/fiqa/splade
2026-01-05 22:48:41,932 - INFO -   Building SPLADE index...
2026-01-05 22:48:41,932 - INFO - Initializing SPLADE Indexer with naver/splade-cocondenser-ensembledistil
2026-01-05 22:48:43,127 - INFO - 🚀 Using 2 GPUs for SPLADE encoding!
2026-01-05 22:48:43,128 - INFO - Encoding 60984 documents with SPLADE...
2026-01-05 22:55:19,200 - INFO - Saving SPLADE index to indices/fiqa/splade/index.npz...
2026-01-05 22:55:24,369 - INFO - SPLADE Indexing complete.
2026-01-05 22:55:25,100 - INFO -   ✓ Index built successfully
2026-01-05 22:55:25,128 - INFO - 
================================================================================
2026-01-05 22:55:25,128 - INFO - Index 11/20: govt/bm25
2026-01-05 22:55:25,128 - INFO - ================================================================================

2026-01-05 22:55:25,129 - INFO - Index already exists and is complete (use --force to rebuild): indices/govt/bm25
2026-01-05 22:55:25,129 - INFO - 
================================================================================
2026-01-05 22:55:25,129 - INFO - Index 12/20: govt/elser
2026-01-05 22:55:25,129 - INFO - ================================================================================

2026-01-05 22:55:25,129 - INFO - Index already exists and is complete (use --force to rebuild): indices/govt/elser
2026-01-05 22:55:25,129 - INFO - 
================================================================================
2026-01-05 22:55:25,129 - INFO - Index 13/20: govt/bge-m3
2026-01-05 22:55:25,129 - INFO - ================================================================================

2026-01-05 22:55:25,129 - INFO - Index already exists and is complete (use --force to rebuild): indices/govt/bge-m3
2026-01-05 22:55:25,129 - INFO - 
================================================================================
2026-01-05 22:55:25,129 - INFO - Index 14/20: govt/bge-base-1.5
2026-01-05 22:55:25,129 - INFO - ================================================================================

2026-01-05 22:55:25,129 - INFO - Index already exists and is complete (use --force to rebuild): indices/govt/bge-base-1.5
2026-01-05 22:55:25,129 - INFO - 
================================================================================
2026-01-05 22:55:25,129 - INFO - Index 15/20: govt/splade
2026-01-05 22:55:25,129 - INFO - ================================================================================

2026-01-05 22:55:25,130 - WARNING - Index directory exists but seems incomplete (missing _SUCCESS). Rebuilding: indices/govt/splade
2026-01-05 22:55:25,130 - INFO - Building splade index for govt
2026-01-05 22:55:25,130 - INFO -   Corpus: data/passage_level_processed/govt/corpus.jsonl
2026-01-05 22:55:25,130 - INFO -   Output: indices/govt/splade
2026-01-05 22:55:25,657 - INFO -   Building SPLADE index...
2026-01-05 22:55:25,657 - INFO - Initializing SPLADE Indexer with naver/splade-cocondenser-ensembledistil
2026-01-05 22:55:26,767 - INFO - 🚀 Using 2 GPUs for SPLADE encoding!
2026-01-05 22:55:26,768 - INFO - Encoding 49607 documents with SPLADE...
2026-01-05 23:00:51,087 - INFO - Saving SPLADE index to indices/govt/splade/index.npz...
2026-01-05 23:00:55,406 - INFO - SPLADE Indexing complete.
2026-01-05 23:00:55,425 - INFO -   ✓ Index built successfully
2026-01-05 23:00:55,455 - INFO - 
================================================================================
2026-01-05 23:00:55,455 - INFO - Index 16/20: cloud/bm25
2026-01-05 23:00:55,455 - INFO - ================================================================================

2026-01-05 23:00:55,456 - INFO - Index already exists and is complete (use --force to rebuild): indices/cloud/bm25
2026-01-05 23:00:55,456 - INFO - 
================================================================================
2026-01-05 23:00:55,456 - INFO - Index 17/20: cloud/elser
2026-01-05 23:00:55,456 - INFO - ================================================================================

2026-01-05 23:00:55,456 - INFO - Index already exists and is complete (use --force to rebuild): indices/cloud/elser
2026-01-05 23:00:55,456 - INFO - 
================================================================================
2026-01-05 23:00:55,456 - INFO - Index 18/20: cloud/bge-m3
2026-01-05 23:00:55,456 - INFO - ================================================================================

2026-01-05 23:00:55,456 - INFO - Index already exists and is complete (use --force to rebuild): indices/cloud/bge-m3
2026-01-05 23:00:55,456 - INFO - 
================================================================================
2026-01-05 23:00:55,456 - INFO - Index 19/20: cloud/bge-base-1.5
2026-01-05 23:00:55,456 - INFO - ================================================================================

2026-01-05 23:00:55,456 - INFO - Index already exists and is complete (use --force to rebuild): indices/cloud/bge-base-1.5
2026-01-05 23:00:55,456 - INFO - 
================================================================================
2026-01-05 23:00:55,456 - INFO - Index 20/20: cloud/splade
2026-01-05 23:00:55,456 - INFO - ================================================================================

2026-01-05 23:00:55,457 - WARNING - Index directory exists but seems incomplete (missing _SUCCESS). Rebuilding: indices/cloud/splade
2026-01-05 23:00:55,457 - INFO - Building splade index for cloud
2026-01-05 23:00:55,457 - INFO -   Corpus: data/passage_level_processed/cloud/corpus.jsonl
2026-01-05 23:00:55,457 - INFO -   Output: indices/cloud/splade
2026-01-05 23:00:56,035 - INFO -   Building SPLADE index...
2026-01-05 23:00:56,035 - INFO - Initializing SPLADE Indexer with naver/splade-cocondenser-ensembledistil
2026-01-05 23:00:57,147 - INFO - 🚀 Using 2 GPUs for SPLADE encoding!
2026-01-05 23:00:57,149 - INFO - Encoding 72439 documents with SPLADE...
2026-01-05 23:08:51,374 - INFO - Saving SPLADE index to indices/cloud/splade/index.npz...
2026-01-05 23:08:55,931 - INFO - SPLADE Indexing complete.
2026-01-05 23:08:56,804 - INFO -   ✓ Index built successfully
2026-01-05 23:08:56,841 - INFO - 
================================================================================
2026-01-05 23:08:56,841 - INFO - SUMMARY
2026-01-05 23:08:56,841 - INFO - ================================================================================
2026-01-05 23:08:56,841 - INFO - Total indices: 20
2026-01-05 23:08:56,841 - INFO - Successful: 20
2026-01-05 23:08:56,841 - INFO - Failed: 0
2026-01-05 23:08:56,841 - INFO - 
✓ All indices built successfully!
